{
  "requestId":  "test",
  "includeMeta": true,
  "actions":  [
    "view:public",
    "approve",
    "create",
    "defer"
  ],
  "principal":  {
    "id":  "donald_duck",
    "policyVersion":  "20210210",
    "roles":  [
      "employee"
    ],
    "attr":  {
      "department":  "marketing",
      "geography":  "GB",
      "team":  "design"
    }
  },
  "resource":  {
    "kind":  "leave_request",
    "policyVersion":  "20210210",
    "instances":  {
      "XX125":  {
        "attr":  {
          "department":  "marketing",
          "geography":  "GB",
          "id":  "XX125",
          "owner":  "john",
          "team":  "design"
        }
      },
      "XX150":  {
        "attr":  {
          "department":  "marketing",
          "geography":  "GB",
          "id":  "XX150",
          "owner":  "mary",
          "team":  "design"
        }
      },
      "XX250":  {
        "attr":  {
          "department":  "marketing",
          "geography":  "GB",
          "id":  "XX250",
          "owner":  "xenia",
          "team":  "design"
        }
      },
      "YY100":  {
        "attr":  {
          "department":  "marketing",
          "dev_record":  true,
          "geography":  "US",
          "id":  "YY100",
          "owner":  "zach",
          "team":  "comms"
        }
      },
      "YY200":  {
        "attr":  {
          "department":  "engineering",
          "dev_record":  true,
          "geography":  "GB",
          "id":  "YY200",
          "owner":  "christa",
          "team":  "cloud"
        }
      }
    }
  },
  "auxData": {
    "jwt": {
      "token": "eyJhbGciOiJFUzM4NCIsImtpZCI6IjE5TGZaYXRFZGc4M1lOYzVyMjNndU1KcXJuND0iLCJ0eXAiOiJKV1QifQ.eyJhdWQiOlsiY2VyYm9zLWp3dC10ZXN0cyJdLCJjdXN0b21BcnJheSI6WyJBIiwiQiIsIkMiXSwiY3VzdG9tSW50Ijo0MiwiY3VzdG9tTWFwIjp7IkEiOiJBQSIsIkIiOiJCQiIsIkMiOiJDQyJ9LCJjdXN0b21TdHJpbmciOiJmb29iYXIiLCJleHAiOjE5NDk5MzQwMzksImlzcyI6ImNlcmJvcy10ZXN0LXN1aXRlIn0.WN_tOScSpd_EI-P5EI1YlagxEgExSfBjAtcrgcF6lyWj1lGpR_GKx9goZEp2p_t5AVWXN_bjz_sMUmJdJa4cVd55Qm1miR-FKu6oNRHnSEWdMFmnArwPw-YDJWfylLFX"
    }
  }
}
