{
  "requestId": "test",
  "includeMeta": true,
  "actions": [
    "view:public",
    "delete",
    "approve"
  ],
  "principal": {
    "id": "john",
    "roles": [
      "employee"
    ],
    "attr": {
      "department": "marketing",
      "geography": "GB",
      "team": "design",
      "ip_address": "10.20.0.5"
    }
  },
  "resource": {
    "kind": "leave_request",
    "scope": "acme.hr.uk",
    "instances": {
      "XX125": {
        "attr": {
          "department": "marketing",
          "geography": "GB",
          "id": "XX125",
          "owner": "john",
          "team": "design"
        }
      }
    }
  }
}
