{
  "requestId": "{{ .UUID }}",
  "actions": [
    "view:public",
    "approve"
  ],
  "principal": {
    "id": "john",
    "policyVersion": "20210210",
    "roles": [
      "employee"
    ],
    "attr": {
      "department": "marketing",
      "geography": "GB",
      "team": "design"
    }
  },
  "resource": {
    "kind": "{{ randomInt 0 1000 | printf `leave_request_%05d` }}",
    "policyVersion": "20210210",
    "instances": {
      "XX125": {
        "attr": {
          "department": "marketing",
          "geography": "GB",
          "id": "XX125",
          "owner": "john",
          "team": "design"
        }
      }
    }
  }
}
